import { Retraite, Transaction, User } from '../types';

export const sampleRetraites: Retraite[] = [
  {
    id: '1',
    identifiant: 'BEN-2024-00123',
    prenom: 'Mamadou',
    nom: 'KONE',
    dateNaissance: '15/03/1960',
    age: 64,
    telephone: '+229 97 12 34 56',
    email: 'mamadou.kone@email.bj',
    adresse: 'Cotonou, Quartier Agla',
    montantPension: 45000,
    typeCompte: 'mobile',
    operateur: 'MTN Mobile Money',
    numeroCompte: '+229 97 12 34 56',
    nomTitulaire: 'Mamadou KONE',
    dateDebutPension: '01/01/2024',
    prochainPaiement: '05/01/2025',
    statut: 'actif',
    createdAt: '2024-01-01T00:00:00Z',
  },
  {
    id: '2',
    identifiant: 'BEN-2024-00124',
    prenom: 'Fatou',
    nom: 'DIALLO',
    dateNaissance: '22/07/1958',
    age: 66,
    telephone: '+229 96 23 45 67',
    email: 'fatou.diallo@email.bj',
    adresse: 'Porto-Novo, Centre Ville',
    montantPension: 50000,
    typeCompte: 'banque',
    operateur: 'Bank of Africa',
    numeroCompte: 'BJ0612345678901234567890',
    nomTitulaire: 'Fatou DIALLO',
    dateDebutPension: '01/02/2024',
    prochainPaiement: '05/01/2025',
    statut: 'actif',
    createdAt: '2024-02-01T00:00:00Z',
  },
  {
    id: '3',
    identifiant: 'BEN-2024-00125',
    prenom: 'Jean',
    nom: 'AGBODJAN',
    dateNaissance: '10/11/1961',
    age: 63,
    telephone: '+229 95 34 56 78',
    email: 'jean.agbodjan@email.bj',
    adresse: 'Parakou, Secteur 3',
    montantPension: 38000,
    typeCompte: 'mobile',
    operateur: 'Moov Money',
    numeroCompte: '+229 95 34 56 78',
    nomTitulaire: 'Jean AGBODJAN',
    dateDebutPension: '01/03/2024',
    prochainPaiement: '05/01/2025',
    statut: 'actif',
    createdAt: '2024-03-01T00:00:00Z',
  },
  {
    id: '4',
    identifiant: 'BEN-2024-00126',
    prenom: 'Marie',
    nom: 'HOUNGBO',
    dateNaissance: '05/05/1959',
    age: 65,
    telephone: '+229 94 45 67 89',
    email: 'marie.houngbo@email.bj',
    adresse: 'Abomey, Rue des Rois',
    montantPension: 42000,
    typeCompte: 'mobile',
    operateur: 'MTN Mobile Money',
    numeroCompte: '+229 94 45 67 89',
    nomTitulaire: 'Marie HOUNGBO',
    dateDebutPension: '01/04/2024',
    prochainPaiement: '05/01/2025',
    statut: 'actif',
    createdAt: '2024-04-01T00:00:00Z',
  },
  {
    id: '5',
    identifiant: 'BEN-2024-00127',
    prenom: 'Abdoul',
    nom: 'SANI',
    dateNaissance: '18/09/1960',
    age: 64,
    telephone: '+229 97 56 78 90',
    email: 'abdoul.sani@email.bj',
    adresse: 'Cotonou, Akpakpa',
    montantPension: 48000,
    typeCompte: 'banque',
    operateur: 'Ecobank',
    numeroCompte: 'BJ0698765432109876543210',
    nomTitulaire: 'Abdoul SANI',
    dateDebutPension: '01/05/2024',
    prochainPaiement: '05/01/2025',
    statut: 'actif',
    createdAt: '2024-05-01T00:00:00Z',
  },
  {
    id: '6',
    identifiant: 'BEN-2024-00128',
    prenom: 'Aminata',
    nom: 'TRAORE',
    dateNaissance: '28/12/1962',
    age: 62,
    telephone: '+229 96 67 89 01',
    email: 'aminata.traore@email.bj',
    adresse: 'Cotonou, Godomey',
    montantPension: 35000,
    typeCompte: 'mobile',
    operateur: 'MTN Mobile Money',
    numeroCompte: '+229 96 67 89 01',
    nomTitulaire: 'Aminata TRAORE',
    dateDebutPension: '01/06/2024',
    prochainPaiement: '05/01/2025',
    statut: 'actif',
    createdAt: '2024-06-01T00:00:00Z',
  },
  {
    id: '7',
    identifiant: 'BEN-2024-00129',
    prenom: 'Séraphin',
    nom: 'GBENOU',
    dateNaissance: '12/04/1961',
    age: 63,
    telephone: '+229 95 78 90 12',
    email: 'seraphin.gbenou@email.bj',
    adresse: 'Porto-Novo, Ouando',
    montantPension: 52000,
    typeCompte: 'banque',
    operateur: 'BIBE',
    numeroCompte: 'BJ0654321098765432109876',
    nomTitulaire: 'Séraphin GBENOU',
    dateDebutPension: '01/07/2024',
    prochainPaiement: '05/01/2025',
    statut: 'actif',
    createdAt: '2024-07-01T00:00:00Z',
  },
  {
    id: '8',
    identifiant: 'BEN-2024-00130',
    prenom: 'Rosine',
    nom: 'ADJAKOU',
    dateNaissance: '30/06/1960',
    age: 64,
    telephone: '+229 94 89 01 23',
    email: 'rosine.adjakou@email.bj',
    adresse: 'Parakou, Zone Industrielle',
    montantPension: 47000,
    typeCompte: 'mobile',
    operateur: 'Moov Money',
    numeroCompte: '+229 94 89 01 23',
    nomTitulaire: 'Rosine ADJAKOU',
    dateDebutPension: '01/08/2024',
    prochainPaiement: '05/01/2025',
    statut: 'actif',
    createdAt: '2024-08-01T00:00:00Z',
  },
  {
    id: '9',
    identifiant: 'BEN-2024-00131',
    prenom: 'Issoufou',
    nom: 'MAÏGA',
    dateNaissance: '14/01/1959',
    age: 65,
    telephone: '+229 97 90 12 34',
    email: 'issoufou.maiga@email.bj',
    adresse: 'Cotonou, Cadjèhoun',
    montantPension: 55000,
    typeCompte: 'banque',
    operateur: 'Bank of Africa',
    numeroCompte: 'BJ0687654321098765432109',
    nomTitulaire: 'Issoufou MAÏGA',
    dateDebutPension: '01/09/2024',
    prochainPaiement: '05/01/2025',
    statut: 'actif',
    createdAt: '2024-09-01T00:00:00Z',
  },
  {
    id: '10',
    identifiant: 'BEN-2024-00132',
    prenom: 'Christelle',
    nom: 'DANVI',
    dateNaissance: '25/08/1963',
    age: 61,
    telephone: '+229 96 01 23 45',
    email: 'christelle.danvi@email.bj',
    adresse: 'Abomey-Calavi, Hlazounto',
    montantPension: 40000,
    typeCompte: 'mobile',
    operateur: 'MTN Mobile Money',
    numeroCompte: '+229 96 01 23 45',
    nomTitulaire: 'Christelle DANVI',
    dateDebutPension: '01/10/2024',
    prochainPaiement: '05/01/2025',
    statut: 'inactif',
    createdAt: '2024-10-01T00:00:00Z',
  },
];

export const sampleTransactions: Transaction[] = [
  {
    id: 'TRX-2024-001234',
    retraiteId: '1',
    retraiteName: 'Mamadou KONE',
    montant: 45000,
    frais: 675,
    type: 'mobile',
    operateur: 'MTN Mobile Money',
    reference: 'MTN-REF-789456',
    statut: 'reussi',
    dateHeure: '05/12/2024 14:35:42',
    traitePar: 'Jean DUPONT',
  },
  {
    id: 'TRX-2024-001235',
    retraiteId: '2',
    retraiteName: 'Fatou DIALLO',
    montant: 50000,
    frais: 0,
    type: 'banque',
    operateur: 'Bank of Africa',
    reference: 'BOA-REF-123456',
    statut: 'reussi',
    dateHeure: '05/12/2024 14:35:30',
    traitePar: 'Jean DUPONT',
  },
  {
    id: 'TRX-2024-001236',
    retraiteId: '3',
    retraiteName: 'Jean AGBODJAN',
    montant: 38000,
    frais: 570,
    type: 'mobile',
    operateur: 'Moov Money',
    reference: 'MOOV-REF-654321',
    statut: 'reussi',
    dateHeure: '05/12/2024 14:35:15',
    traitePar: 'Jean DUPONT',
  },
  {
    id: 'TRX-2024-001237',
    retraiteId: '4',
    retraiteName: 'Marie HOUNGBO',
    montant: 42000,
    frais: 630,
    type: 'mobile',
    operateur: 'MTN Mobile Money',
    reference: 'MTN-REF-789457',
    statut: 'echoue',
    dateHeure: '05/12/2024 14:35:00',
    traitePar: 'Jean DUPONT',
    errorMessage: 'Solde insuffisant sur le compte Mobile Money',
  },
  {
    id: 'TRX-2024-001238',
    retraiteId: '5',
    retraiteName: 'Abdoul SANI',
    montant: 48000,
    frais: 0,
    type: 'banque',
    operateur: 'Ecobank',
    reference: 'ECO-REF-987654',
    statut: 'reussi',
    dateHeure: '05/12/2024 14:34:45',
    traitePar: 'Jean DUPONT',
  },
];

export const currentUser: User = {
  id: '1',
  nom: 'DUPONT',
  prenom: 'Jean',
  email: 'jean.dupont@gouv.bj',
  role: 'super_admin',
  departement: 'Direction Générale',
  dateCreation: '15/01/2024',
  dernierAcces: 'Il y a 2 heures',
  actif: true,
};

export const dashboardStats = {
  totalRetraites: 2456,
  newThisMonth: 124,
  pensionsVersees: 1234567890,
  successRate: 98.5,
  paiementsEnAttente: 45,
};

export const chartData = [
  { month: 'Juillet', banque: 420, mobile: 380 },
  { month: 'Août', banque: 450, mobile: 410 },
  { month: 'Septembre', banque: 480, mobile: 430 },
  { month: 'Octobre', banque: 510, mobile: 460 },
  { month: 'Novembre', banque: 540, mobile: 490 },
  { month: 'Décembre', banque: 550, mobile: 500 },
];
